<?xml version="1.0" encoding="UTF-8"?>
<ristorante
	xmlns:xsi="http://www.w3.org/2001/XMLSchema-instance"
	xsi:noNamespaceSchemaLocation="18Giu2021.xsd">
	<nome>nome</nome>
	<localita>localita</localita>
	<indirizzo>
		<via>via</via>
		<numeroCivico>0</numeroCivico>
		<CAP>0</CAP>
	</indirizzo>
	<telefono>
		<prefisso>prefisso</prefisso>
		<numero>0</numero>
	</telefono>
	<link>link</link>
	<antipasti>
		<piatto>
			<nome>nome</nome>
			<prezzo>0.0</prezzo>
		</piatto>
	</antipasti>
	<primi>
		<piatto>
			<nome>nome</nome>
			<prezzo>0.0</prezzo>
		</piatto>
		<piatto>
			<nome>nome</nome>
			<prezzo>0.0</prezzo>
		</piatto>
		<piatto>
			<nome>nome</nome>
			<prezzo>0.0</prezzo>
		</piatto>
	</primi>
	<secondi>
		<piatto>
			<nome>nome</nome>
			<prezzo>0.0</prezzo>
		</piatto>
	</secondi>
	<contorni>
		<piatto>
			<nome>nome</nome>
			<prezzo>0.0</prezzo>
		</piatto>
	</contorni>
	<dessert>
		<piatto>
			<nome>nome</nome>
			<prezzo>0.0</prezzo>
		</piatto>
	</dessert>
</ristorante>
